{
  "tags": ["grem", "ranged"],
  "hp": 12,
  "speed": 1.0,
  "melee_skill": 30,
  "ranged_skill": 45,
  "build_seconds": 3.0,
  "preferred_position": "back",
  "position_priority": 1,
  "turn_rate": 720.0,
  "backward_pace": 0.6,
  "items": ["weapons/spitter_spit", "weapons/spitter_claw", "weapons/spitter_bite"],
  "slots": ["hand", "hand", "mouth"]
}
