{
  "tags": ["human", "martial", "leader"],
  "hp": 30,
  "speed": 0.8,
  "melee_skill": 55,
  "build_seconds": 6.0,
  "preferred_position": "mid",
  "position_priority": 2,
  "courage": 65,
  "leadership": 2,
  "turn_rate": 360.0,
  "backward_pace": 0.4,
  "items": ["weapons/militia_spear"],
  "slots": ["hand", "hand"],
  "proficiencies": {
    "polearm": 2
  }
}
