{
  "tags": ["grem", "leader"],
  "cost_food": 20,
  "hp": 30,
  "speed": 1.0,
  "melee_skill": 50,
  "build_seconds": 6.0,
  "preferred_position": "mid",
  "position_priority": 2,
  "courage": 70,
  "leadership": 3,
  "tactics": ["coordinated"],
  "turn_rate": 540.0,
  "backward_pace": 0.5,
  "items": ["weapons/grem_bite", "weapons/grem_claw"],
  "slots": ["hand", "hand", "mouth"]
}
