{
  "tags": ["grem", "brute"],
  "hp": 60,
  "speed": 0.7,
  "melee_skill": 35,
  "defence": 15,
  "strength": 14,
  "footprint_depth": 2,
  "footprint_width": 2,
  "build_seconds": 4.0,
  "position_priority": 2,
  "turn_rate": 270.0,
  "backward_pace": 0.25,
  "items": ["weapons/brute_fists", "weapons/brute_bite"],
  "slots": ["hand", "hand", "mouth"]
}
